{
  "version": 1,
  "scannerVersion": "1.1.0",
  "generatedAt": "2026-06-08T13:39:06.449Z",
  "root": "/Users/vcsm/Desktop/VCSM",
  "scanDurationMs": 6492,
  "confidence": "HIGH",
  "edgeFunctionCount": 52,
  "data": {
    "version": 1,
    "generatedAt": "2026-06-08T13:39:02.624Z",
    "edgeFunctions": [
      {
        "function": "_shared/securityHeaders",
        "caller": null,
        "appId": "VCSM",
        "root": "apps/VCSM",
        "feature": null,
        "route": "apps/VCSM/functions/_shared/securityHeaders.js",
        "file": "apps/VCSM/functions/_shared/securityHeaders.js",
        "source": "edge-function-file",
        "confidence": "HIGH",
        "evidence": [
          "edge function file exists"
        ]
      },
      {
        "function": "/api/answers/questions",
        "caller": "submitQuestion",
        "appId": "Traffic",
        "root": "apps/Traffic",
        "feature": "answers",
        "engine": null,
        "route": null,
        "file": "apps/Traffic/src/features/answers/hooks/useSubmitQuestion.js",
        "source": "fetch-mutation",
        "confidence": "HIGH",
        "evidence": [
          "mutation fetch extracted from AST"
        ]
      },
      {
        "function": "auth-register-recovery",
        "caller": "dalRegisterRecoveryPermit",
        "appId": "VCSM",
        "root": "apps/VCSM",
        "feature": "auth",
        "engine": null,
        "route": null,
        "file": "apps/VCSM/src/features/auth/password-recovery/dal/resetPasswordSecure.dal.js",
        "source": "supabase-invoke",
        "confidence": "HIGH",
        "evidence": [
          "Supabase function invoke extracted from AST"
        ]
      },
      {
        "function": "auth-register-recovery",
        "caller": null,
        "appId": "VCSM",
        "root": "apps/VCSM",
        "feature": null,
        "route": "apps/VCSM/supabase/functions/auth-register-recovery/index.ts",
        "file": "apps/VCSM/supabase/functions/auth-register-recovery/index.ts",
        "source": "edge-function-file",
        "confidence": "HIGH",
        "evidence": [
          "edge function file exists"
        ]
      },
      {
        "function": "auth-reset-password-secure",
        "caller": "dalUpdatePasswordSecure",
        "appId": "VCSM",
        "root": "apps/VCSM",
        "feature": "auth",
        "engine": null,
        "route": null,
        "file": "apps/VCSM/src/features/auth/password-recovery/dal/resetPasswordSecure.dal.js",
        "source": "supabase-invoke",
        "confidence": "HIGH",
        "evidence": [
          "Supabase function invoke extracted from AST"
        ]
      },
      {
        "function": "auth-reset-password-secure",
        "caller": null,
        "appId": "VCSM",
        "root": "apps/VCSM",
        "feature": null,
        "route": "apps/VCSM/supabase/functions/auth-reset-password-secure/index.ts",
        "file": "apps/VCSM/supabase/functions/auth-reset-password-secure/index.ts",
        "source": "edge-function-file",
        "confidence": "HIGH",
        "evidence": [
          "edge function file exists"
        ]
      },
      {
        "function": "create-org-member",
        "caller": "createOrgMember",
        "appId": "wentrex",
        "root": "apps/wentrex",
        "feature": "services",
        "engine": null,
        "route": null,
        "file": "apps/wentrex/src/features/services/supabase/createOrgMember.js",
        "source": "supabase-invoke",
        "confidence": "HIGH",
        "evidence": [
          "Supabase function invoke extracted from AST"
        ]
      },
      {
        "function": "create-org-member",
        "caller": null,
        "appId": "wentrex",
        "root": "apps/wentrex",
        "feature": null,
        "route": "apps/wentrex/supabase/functions/create-org-member/index.ts",
        "file": "apps/wentrex/supabase/functions/create-org-member/index.ts",
        "source": "edge-function-file",
        "confidence": "HIGH",
        "evidence": [
          "edge function file exists"
        ]
      },
      {
        "function": "create-parent",
        "caller": "createParent",
        "appId": "wentrex",
        "root": "apps/wentrex",
        "feature": "services",
        "engine": null,
        "route": null,
        "file": "apps/wentrex/src/features/services/supabase/createParent.js",
        "source": "supabase-invoke",
        "confidence": "HIGH",
        "evidence": [
          "Supabase function invoke extracted from AST"
        ]
      },
      {
        "function": "create-parent",
        "caller": "createParent",
        "appId": "wentrex",
        "root": "apps/wentrex",
        "feature": null,
        "engine": null,
        "route": null,
        "file": "apps/wentrex/src/learning/parent/createParent.js",
        "source": "supabase-invoke",
        "confidence": "HIGH",
        "evidence": [
          "Supabase function invoke extracted from AST"
        ]
      },
      {
        "function": "create-parent",
        "caller": null,
        "appId": "wentrex",
        "root": "apps/wentrex",
        "feature": null,
        "route": "apps/wentrex/supabase/functions/create-parent/index.ts",
        "file": "apps/wentrex/supabase/functions/create-parent/index.ts",
        "source": "edge-function-file",
        "confidence": "HIGH",
        "evidence": [
          "edge function file exists"
        ]
      },
      {
        "function": "create-student",
        "caller": "createStudent",
        "appId": "wentrex",
        "root": "apps/wentrex",
        "feature": "services",
        "engine": null,
        "route": null,
        "file": "apps/wentrex/src/features/services/supabase/createStudent.js",
        "source": "supabase-invoke",
        "confidence": "HIGH",
        "evidence": [
          "Supabase function invoke extracted from AST"
        ]
      },
      {
        "function": "create-student",
        "caller": null,
        "appId": "wentrex",
        "root": "apps/wentrex",
        "feature": null,
        "route": "apps/wentrex/supabase/functions/create-student/index.ts",
        "file": "apps/wentrex/supabase/functions/create-student/index.ts",
        "source": "edge-function-file",
        "confidence": "HIGH",
        "evidence": [
          "edge function file exists"
        ]
      },
      {
        "function": "create-tenant",
        "caller": null,
        "appId": "wentrex",
        "root": "apps/wentrex",
        "feature": null,
        "route": "apps/wentrex/supabase/functions/create-tenant/index.ts",
        "file": "apps/wentrex/supabase/functions/create-tenant/index.ts",
        "source": "edge-function-file",
        "confidence": "HIGH",
        "evidence": [
          "edge function file exists"
        ]
      },
      {
        "function": "delete-citizen-account",
        "caller": "dalDeleteCitizenAccountFull",
        "appId": "VCSM",
        "root": "apps/VCSM",
        "feature": "settings",
        "engine": null,
        "route": null,
        "file": "apps/VCSM/src/features/settings/account/dal/account.write.dal.js",
        "source": "supabase-invoke",
        "confidence": "HIGH",
        "evidence": [
          "Supabase function invoke extracted from AST"
        ]
      },
      {
        "function": "delete-citizen-account",
        "caller": null,
        "appId": "VCSM",
        "root": "apps/VCSM",
        "feature": null,
        "route": "apps/VCSM/supabase/functions/delete-citizen-account/index.ts",
        "file": "apps/VCSM/supabase/functions/delete-citizen-account/index.ts",
        "source": "edge-function-file",
        "confidence": "HIGH",
        "evidence": [
          "edge function file exists"
        ]
      },
      {
        "function": "fetch",
        "caller": "triggerTrafficRevalidation",
        "appId": "Traffic",
        "root": "apps/Traffic",
        "feature": null,
        "engine": null,
        "route": null,
        "file": "apps/Traffic/src/lib/revalidateClient.js",
        "source": "fetch-mutation",
        "confidence": "HIGH",
        "evidence": [
          "mutation fetch extracted from AST"
        ]
      },
      {
        "function": "fetch",
        "caller": "onRequest",
        "appId": "VCSM",
        "root": "apps/VCSM",
        "feature": null,
        "engine": null,
        "route": null,
        "file": "apps/VCSM/functions/vport/[slug]/card.js",
        "source": "fetch-mutation",
        "confidence": "HIGH",
        "evidence": [
          "mutation fetch extracted from AST"
        ]
      },
      {
        "function": "fetch",
        "caller": "uploadToCloudflare",
        "appId": "VCSM",
        "root": "apps/VCSM",
        "feature": null,
        "engine": null,
        "route": null,
        "file": "apps/VCSM/src/services/cloudflare/uploadToCloudflare.js",
        "source": "fetch-mutation",
        "confidence": "HIGH",
        "evidence": [
          "mutation fetch extracted from AST"
        ]
      },
      {
        "function": "fetch",
        "caller": "doUpload",
        "appId": "wentrex",
        "root": "apps/wentrex",
        "feature": "services",
        "engine": null,
        "route": null,
        "file": "apps/wentrex/src/features/services/cloudflare/uploadToCloudflare.js",
        "source": "fetch-mutation",
        "confidence": "HIGH",
        "evidence": [
          "mutation fetch extracted from AST"
        ]
      },
      {
        "function": "how-to/[slug]",
        "caller": null,
        "appId": "VCSM",
        "root": "apps/VCSM",
        "feature": null,
        "route": "apps/VCSM/functions/how-to/[slug].js",
        "file": "apps/VCSM/functions/how-to/[slug].js",
        "source": "edge-function-file",
        "confidence": "HIGH",
        "evidence": [
          "edge function file exists"
        ]
      },
      {
        "function": "lovedrop/v/[id]",
        "caller": null,
        "appId": "VCSM",
        "root": "apps/VCSM",